-- Writes that actually reach Valkey.
--
-- Every other suite asserts what the wrapper held in memory. This one asserts
-- what the server holds afterwards, read back through the PROBE rather than
-- through the wrapper's own scan: a write checked with the read path proves
-- only that the two halves agree with each other, and they share a mapping
-- layer that could be wrong in the same direction twice.
CREATE SERVER dml_srv FOREIGN DATA WRAPPER valkey_fdw
    OPTIONS (host 'valkey', port '6379');
CREATE USER MAPPING FOR CURRENT_USER SERVER dml_srv;
CREATE FOREIGN TABLE d_str (k text OPTIONS (key 'true'), v text)
    SERVER dml_srv OPTIONS (tabletype 'string', keyprefix 'd:');
CREATE FOREIGN TABLE d_hash (k text OPTIONS (key 'true'),
                             a text OPTIONS (field 'alpha'),
                             b text OPTIONS (field 'beta'))
    SERVER dml_srv OPTIONS (tabletype 'hash', keyprefix 'dh:');
CREATE FOREIGN TABLE d_set (k text OPTIONS (key 'true'), m text)
    SERVER dml_srv OPTIONS (tabletype 'set', keyprefix 'ds:');
CREATE FOREIGN TABLE d_zset (k text OPTIONS (key 'true'),
                             m text OPTIONS (member 'true'),
                             s text OPTIONS (score 'true'))
    SERVER dml_srv OPTIONS (tabletype 'zset', keyprefix 'dz:');
CREATE FOREIGN TABLE d_list (k text OPTIONS (key 'true'), m text)
    SERVER dml_srv OPTIONS (tabletype 'list', keyprefix 'dl:');
CREATE FOREIGN TABLE d_bin (k text OPTIONS (key 'true'), v bytea)
    SERVER dml_srv OPTIONS (tabletype 'string', keyprefix 'db:');
CREATE FUNCTION d_err(sql text) RETURNS text LANGUAGE plpgsql AS $$
BEGIN
    EXECUTE sql;
    RETURN 'no error';
EXCEPTION WHEN OTHERS THEN
    RETURN SQLSTATE || ': ' || SQLERRM;
END $$;
-- ---------------------------------------------------------------------------
-- COMMIT applies; ROLLBACK applies nothing.
--
-- The headline of the whole phase, and the first step at which it can fail.
-- ---------------------------------------------------------------------------
BEGIN;
INSERT INTO d_str VALUES ('d:a', 'one'), ('d:b', 'two');
COMMIT;
SELECT convert_from(key,'UTF8') AS key, keytype
FROM valkey_fdw_test_keys('dml_srv', 0, 'd:') ORDER BY 1;
 key | keytype 
-----+---------
 d:a | string
 d:b | string
(2 rows)

SELECT convert_from(val_part,'UTF8') AS a_value
FROM valkey_fdw_test_probe('dml_srv', 0, 'GET', 'd:a');
 a_value 
---------
 one
(1 row)

BEGIN;
INSERT INTO d_str VALUES ('d:rolled', 'never');
ROLLBACK;
SELECT count(*) AS rolled_back_key_absent
FROM valkey_fdw_test_probe('dml_srv', 0, 'EXISTS', 'd:rolled') WHERE num = 1;
 rolled_back_key_absent 
------------------------
                      0
(1 row)

-- An error anywhere in the transaction discards the whole unit, including the
-- statements that had already succeeded.
BEGIN;
INSERT INTO d_str VALUES ('d:partial1', 'x');
SELECT d_err($$INSERT INTO d_str VALUES (NULL, 'y')$$) AS mid_transaction_error;
                      mid_transaction_error                      
-----------------------------------------------------------------
 23502: null value in column "k" has no representation in Valkey
(1 row)

ROLLBACK;
SELECT count(*) AS nothing_from_failed_transaction
FROM valkey_fdw_test_probe('dml_srv', 0, 'EXISTS', 'd:partial1') WHERE num = 1;
 nothing_from_failed_transaction 
---------------------------------
                               0
(1 row)

-- ---------------------------------------------------------------------------
-- Every shape lands with the right Valkey type and the right contents.
-- ---------------------------------------------------------------------------
BEGIN;
INSERT INTO d_hash VALUES ('dh:h', 'av', 'bv');
INSERT INTO d_set  VALUES ('ds:s', 'm1'), ('ds:s', 'm2');
INSERT INTO d_zset VALUES ('dz:z', 'zm', '1.5');
INSERT INTO d_list VALUES ('dl:l', 'first'), ('dl:l', 'second');
COMMIT;
SELECT convert_from(key,'UTF8') AS key, keytype
FROM valkey_fdw_test_keys('dml_srv', 0, 'd') ORDER BY 1;
 key  | keytype 
------+---------
 d:a  | string
 d:b  | string
 dh:h | hash
 dl:l | list
 ds:s | set
 dz:z | zset
(6 rows)

SELECT convert_from(key_part,'UTF8') AS field, convert_from(val_part,'UTF8') AS value
FROM valkey_fdw_test_probe_pairs('dml_srv', 0, 'HGETALL', 'dh:h') ORDER BY 1;
 field | value 
-------+-------
 alpha | av
 beta  | bv
       | 
(3 rows)

SELECT convert_from(val_part,'UTF8') AS member
FROM valkey_fdw_test_probe('dml_srv', 0, 'SMEMBERS', 'ds:s') ORDER BY 1;
 member 
--------
 m1
 m2
 
(3 rows)

SELECT dbl AS score
FROM valkey_fdw_test_probe('dml_srv', 0, 'ZSCORE', 'dz:z', 'zm');
 score 
-------
   1.5
(1 row)

-- A list keeps insertion order, which is the only thing distinguishing RPUSH
-- from LPUSH and is invisible to a set-like assertion.
SELECT convert_from(val_part,'UTF8') AS element
FROM valkey_fdw_test_probe('dml_srv', 0, 'LRANGE', 'dl:l', '0', '-1');
 element 
---------
 
 first
 second
(3 rows)

-- ---------------------------------------------------------------------------
-- Bytes survive: an embedded NUL and invalid UTF-8 both round-trip.
--
-- This is the assertion the whole binary-safe command layer exists for, and
-- the first point at which it is tested through a real write.
-- ---------------------------------------------------------------------------
BEGIN;
INSERT INTO d_bin VALUES ('db:nul', '\x61006200ff'::bytea);
COMMIT;
SELECT val_part = '\x61006200ff'::bytea AS bytes_survived_the_write,
       length(val_part) AS len
FROM valkey_fdw_test_probe('dml_srv', 0, 'GET', 'db:nul');
 bytes_survived_the_write | len 
--------------------------+-----
 t                        |   5
(1 row)

-- ---------------------------------------------------------------------------
-- UPDATE and DELETE, and a rename that keeps what the table does not map.
--
-- The rename is the case a DEL-then-SET rewrite gets wrong: the extra hash
-- field belongs to nobody's column and must still be there afterwards.
-- ---------------------------------------------------------------------------
SELECT count(*) FROM valkey_fdw_test_probe('dml_srv', 0,
       'HSET', 'dh:ren', 'alpha', 'a', 'beta', 'b', 'unmapped', 'keep me');
 count 
-------
     1
(1 row)

BEGIN;
UPDATE d_hash SET k = 'dh:renamed' WHERE k = 'dh:ren';
COMMIT;
SELECT convert_from(key_part,'UTF8') AS field, convert_from(val_part,'UTF8') AS value
FROM valkey_fdw_test_probe_pairs('dml_srv', 0, 'HGETALL', 'dh:renamed') ORDER BY 1;
  field   |  value  
----------+---------
 alpha    | a
 beta     | b
 unmapped | keep me
          | 
(4 rows)

SELECT count(*) AS old_key_gone
FROM valkey_fdw_test_probe('dml_srv', 0, 'EXISTS', 'dh:ren') WHERE num = 1;
 old_key_gone 
--------------
            0
(1 row)

BEGIN;
UPDATE d_str SET v = 'ONE' WHERE k = 'd:a';
DELETE FROM d_str WHERE k = 'd:b';
COMMIT;
SELECT convert_from(val_part,'UTF8') AS updated
FROM valkey_fdw_test_probe('dml_srv', 0, 'GET', 'd:a');
 updated 
---------
 ONE
(1 row)

SELECT count(*) AS deleted_key_gone
FROM valkey_fdw_test_probe('dml_srv', 0, 'EXISTS', 'd:b') WHERE num = 1;
 deleted_key_gone 
------------------
                0
(1 row)

-- ---------------------------------------------------------------------------
-- The refusals, at COMMIT, with the session still usable afterwards.
--
-- Each is a phase-1 sentinel, so each may say "no changes were applied"
-- without qualification - and the keyspace assertion after it is what makes
-- that claim testable rather than merely asserted in a message.
-- ---------------------------------------------------------------------------
SELECT count(*) AS keys_before
FROM valkey_fdw_test_keys('dml_srv', 0, 'd');
 keys_before 
-------------
           7
(1 row)

-- A key this transaction creates that already exists: 23505.
BEGIN;
INSERT INTO d_str VALUES ('d:a', 'again');
COMMIT;
ERROR:  a key this transaction creates already exists in Valkey
DETAIL:  Valkey refused the write: 1 d:a check 2
HINT:  No changes were applied in Valkey; the transaction has been rolled back.
CONTEXT:  valkey_fdw pre-commit flush; no changes were applied in Valkey.
-- A key that holds another Valkey type: 42804. Seeded under this table's own
-- prefix, so the collision is one a user could actually hit rather than one
-- the keyprefix rule would have refused first.
SELECT count(*) FROM valkey_fdw_test_probe('dml_srv', 0, 'HSET', 'd:typ', 'f', 'v');
 count 
-------
     1
(1 row)

BEGIN;
INSERT INTO d_str VALUES ('d:typ', 'not a hash');
COMMIT;
ERROR:  a key holds a different Valkey type than its table declares
DETAIL:  Valkey refused the write: 1 d:typ hash
HINT:  No changes were applied in Valkey; the transaction has been rolled back.
CONTEXT:  valkey_fdw pre-commit flush; no changes were applied in Valkey.
-- An UPDATE of a key removed by someone else after the row was read: 40001.
BEGIN;
UPDATE d_str SET v = 'z' WHERE k = 'd:a';
SELECT count(*) FROM valkey_fdw_test_probe('dml_srv', 0, 'DEL', 'd:a');
 count 
-------
     1
(1 row)

COMMIT;
ERROR:  a key this transaction updates was removed concurrently
DETAIL:  Valkey refused the write: 1 d:a check 2
HINT:  No changes were applied in Valkey; the transaction has been rolled back.
CONTEXT:  valkey_fdw pre-commit flush; no changes were applied in Valkey.
-- Nothing above changed the keyspace beyond the DEL the test itself issued.
SELECT count(*) AS keys_after
FROM valkey_fdw_test_keys('dml_srv', 0, 'd');
 keys_after 
------------
          7
(1 row)

-- The session is still usable: every refusal above left the connection in a
-- state the pool discarded rather than reused at an unknown reply offset.
BEGIN;
INSERT INTO d_str VALUES ('d:after', 'still works');
COMMIT;
SELECT convert_from(val_part,'UTF8') AS after_refusals
FROM valkey_fdw_test_probe('dml_srv', 0, 'GET', 'd:after');
 after_refusals 
----------------
 still works
(1 row)

-- ---------------------------------------------------------------------------
-- The script is loaded once per connection, not once per transaction.
--
-- The steady state is a bare EVALSHA. A SCRIPT LOAD on every flush would work
-- and would cost a round trip's worth of the script's own bytes every time,
-- which is exactly the kind of regression nothing else here would notice.
-- ---------------------------------------------------------------------------
SELECT flushes AS flushes_before FROM valkey_fdw_test_flush_stats() \gset
DO $$
BEGIN
    FOR i IN 1..20 LOOP
        EXECUTE format('INSERT INTO d_str VALUES (%L, %L)', 'd:loop'||i, 'v');
    END LOOP;
END $$;
SELECT flushes > :flushes_before AS flushed_again,
       retries AS retries_should_be_zero
FROM valkey_fdw_test_flush_stats();
 flushed_again | retries_should_be_zero 
---------------+------------------------
 t             |                      0
(1 row)

SELECT count(*) AS loop_keys_present
FROM valkey_fdw_test_keys('dml_srv', 0, 'd:loop');
 loop_keys_present 
-------------------
                20
(1 row)

-- ---------------------------------------------------------------------------
-- COPY FROM.
--
-- It reaches ExecForeignInsert through BeginForeignInsert, which brings no
-- plan and no fdw_private - so everything BeginForeignModify reads from the
-- plan has to be derived from the relation. That is sound only because this
-- path is INSERT: no junk row-identity columns, and every mapped column is
-- assigned by definition. While the callback was unregistered COPY was
-- refused outright, because CopyFrom passed no state to dereference.
-- ---------------------------------------------------------------------------
BEGIN;
COPY d_str (k, v) FROM STDIN;
COMMIT;
SELECT convert_from(key,'UTF8') AS key
FROM valkey_fdw_test_keys('dml_srv', 0, 'd:c') ORDER BY 1;
 key  
------
 d:c1
 d:c2
 d:c3
(3 rows)

SELECT convert_from(val_part,'UTF8') AS c2_value
FROM valkey_fdw_test_probe('dml_srv', 0, 'GET', 'd:c2');
 c2_value 
----------
 two
(1 row)

-- COPY is part of the transaction like any other write.
BEGIN;
COPY d_str (k, v) FROM STDIN;
ROLLBACK;
SELECT count(*) AS rolled_back_copy_absent
FROM valkey_fdw_test_probe('dml_srv', 0, 'EXISTS', 'd:crolled') WHERE num = 1;
 rolled_back_copy_absent 
-------------------------
                       0
(1 row)

-- One bad row aborts the whole COPY: the rows before it are buffered and go
-- with the transaction, which is the only behaviour consistent with the unit
-- being atomic.
BEGIN;
COPY d_str (k, v) FROM STDIN;
ERROR:  key does not begin with the table's keyprefix
DETAIL:  Table "d_str" is scoped to keys beginning with "d:".
HINT:  The key column holds the complete Valkey key. Include the "d:" prefix in the value you write.
CONTEXT:  COPY d_str
ROLLBACK;
SELECT count(*) AS partial_copy_absent
FROM valkey_fdw_test_probe('dml_srv', 0, 'EXISTS', 'd:cok') WHERE num = 1;
 partial_copy_absent 
---------------------
                   0
(1 row)

-- COPY into a readonly table is refused by core, from IsForeignRelUpdatable,
-- before the callback is reached.
CREATE FOREIGN TABLE d_ro (k text OPTIONS (key 'true'), v text)
    SERVER dml_srv OPTIONS (tabletype 'string', keyprefix 'd:', readonly 'true');
BEGIN;
COPY d_ro (k, v) FROM STDIN;
ERROR:  foreign table "d_ro" does not allow inserts
ROLLBACK;
DROP FOREIGN TABLE d_ro;
-- A batch larger than one row is what GetForeignModifyBatchSize enables, and
-- COPY is the only caller that uses it. Every row must land: a batch loop
-- that returned a short count would drop rows with no error anywhere.
BEGIN;
COPY d_str (k, v) FROM STDIN;
SELECT live_ops AS buffered_by_copy FROM valkey_fdw_test_wbuf_stats();
 buffered_by_copy 
------------------
                5
(1 row)

COMMIT;
SELECT count(*) AS batch_keys_present
FROM valkey_fdw_test_keys('dml_srv', 0, 'd:b');
 batch_keys_present 
--------------------
                  5
(1 row)

-- ---------------------------------------------------------------------------
-- DELETE ... RETURNING returns the row that was deleted (W1).
--
-- It used to return one row of NULLs: core adds its own wholerow junk column
-- for a foreign-table DELETE only when row triggers exist, and a deferred
-- write has no remote RETURNING to fetch the old row from - so core stored an
-- all-null tuple, the count was right and every column was empty. A plausible
-- empty result is the failure this project refuses everywhere else, so the
-- row is now captured locally by asking for a wholerow at plan time.
-- ---------------------------------------------------------------------------
SELECT valkey_fdw_test_poke('dml_srv', 'd:ret1', 'returned');
 valkey_fdw_test_poke 
----------------------
                    1
(1 row)

BEGIN;
DELETE FROM d_str WHERE k = 'd:ret1' RETURNING k, v;
   k    |    v     
--------+----------
 d:ret1 | returned
(1 row)

COMMIT;
SELECT count(*) AS deleted_for_real
FROM valkey_fdw_test_probe('dml_srv', 0, 'EXISTS', 'd:ret1') WHERE num = 1;
 deleted_for_real 
------------------
                0
(1 row)

-- ---------------------------------------------------------------------------
-- An UPDATE may clear every mapped hash field; an INSERT may not (W5).
--
-- Clearing every mapped field means HDEL them, which is a legitimate request
-- and had no way to be expressed. The unmapped field survives, which is the
-- whole reason this is not simply a DELETE. For INSERT the refusal stands: a
-- row setting none of the mapped fields would create nothing while reporting
-- one row inserted.
-- ---------------------------------------------------------------------------
SELECT count(*) FROM valkey_fdw_test_probe('dml_srv', 0,
       'HSET', 'dh:clear', 'alpha', 'a', 'beta', 'b', 'unmapped', 'survives');
 count 
-------
     1
(1 row)

BEGIN;
UPDATE d_hash SET a = NULL, b = NULL WHERE k = 'dh:clear';
COMMIT;
SELECT convert_from(key_part,'UTF8') AS field, convert_from(val_part,'UTF8') AS value
FROM valkey_fdw_test_probe_pairs('dml_srv', 0, 'HGETALL', 'dh:clear') ORDER BY 1;
  field   |  value   
----------+----------
 unmapped | survives
          | 
(2 rows)

SELECT d_err($$INSERT INTO d_hash VALUES ('dh:none', NULL, NULL)$$)
    AS insert_all_null_still_refused;
        insert_all_null_still_refused         
----------------------------------------------
 23502: every mapped field of the row is null
(1 row)

-- ---------------------------------------------------------------------------
-- An empty transaction costs nothing.
-- ---------------------------------------------------------------------------
SELECT calls AS calls_before, empty_returns AS empty_before
FROM valkey_fdw_test_flush_stats() \gset
BEGIN;
SELECT count(*) >= 0 AS read_only FROM d_str;
 read_only 
-----------
 t
(1 row)

COMMIT;
SELECT calls > :calls_before          AS flush_was_called,
       empty_returns > :empty_before  AS returned_early
FROM valkey_fdw_test_flush_stats();
 flush_was_called | returned_early 
------------------+----------------
 t                | t
(1 row)

DROP FOREIGN TABLE d_str, d_hash, d_set, d_zset, d_list, d_bin;
DROP FUNCTION d_err(text);
DROP USER MAPPING FOR CURRENT_USER SERVER dml_srv;
DROP SERVER dml_srv;
